{
  "schema_version": 1,
  "record_id": "next3-sd-cmd8-crc-b-hardware-20260810-01",
  "roadmap_package": "NEXT-3",
  "contract_id": "next3-negative-conformance-v1-20260810",
  "status": "hardware_observed",
  "candidate": {
    "candidate_id": "sd-spi-cmd8-bad-crc",
    "defect_class": "SD SPI CMD8 CRC7 rejection",
    "source_kind": "explicit_fault_injection"
  },
  "artifact_audit": {
    "reproducibility": "reproduced",
    "source_commit": "e78cabbe20416eb2347e0db09408bf906d41c698",
    "sdk_version": "2.2.0",
    "sdk_commit": "a1438dff1d38bd9c65dbd693f0e5db4b9ae91779",
    "toolchain": {
      "arm_none_eabi_gcc": "13.2.1 20231009",
      "cmake": "3.28.3",
      "ninja": "1.11.1",
      "generator": "Ninja",
      "build_timestamp": "2026-08-10T05:30:00Z",
      "lcd_variant": "pio-rgb565"
    },
    "bin_sha256": "6665ca51944e2c1fb2f7e2ba7adb01ce6878290aac0dfb929202714b83509bd0",
    "uf2_sha256": "43ea10982d6f9b1d1adf9565b2b88f8b1866ddd60410b4ae53fda8e2f9a3e958",
    "same_build_bin_and_uf2": true,
    "evidence": [
      "A1-to-B executable diff is limited to application identity, EVIDENCE namespace and expected trace CRC identity, and transmitted CMD8 CRC 0x87 to 0x85",
      "CMD0, CMD8 argument, SPI setup, CS framing, response polling, R7 parsing, timeouts, filesystem, keys, and backend are unchanged",
      "canonical tree and a separate clean clone produced identical BIN and UF2 SHA-256 values",
      "source bundle provenance/picocalc-next3-sd-crc-b.bundle SHA-256 3e3fded89db4d4feb9a0d1c810d388e18ccc49c698ab466a371e3c2c94f1739a"
    ],
    "blocking_gaps": []
  },
  "defect_oracle": {
    "frozen_before_emulator_run": true,
    "expected_failure": "card is present, CMD0 returns R1 0x01, bad-CRC CMD8 returns R1 0x09 with idle-state plus COM_CRC_ERROR, initialization stops at CMD8, no later initialization command or filesystem access occurs, and app status is fail",
    "excluded_failure_causes": [
      "card not detected",
      "CMD0 failure",
      "illegal-command, address-error, or parameter-error R1 bits",
      "unsupported MMIO",
      "firmware exception",
      "cycle limit",
      "missing or incomplete UART capture",
      "wrong source or artifact identity"
    ]
  },
  "emulator_observation": {
    "status": "pending",
    "result": "pending",
    "reason": "hardware matches every frozen oracle field, so exactly one first emulator run is now allowed but has not yet been executed",
    "evidence": []
  },
  "hardware_observation": {
    "status": "complete",
    "result": "fail",
    "reason": "the physical SD card rejected CMD8 CRC 0x85 with R1 0x09, containing idle-state plus COM_CRC_ERROR, and initialization stopped at the frozen CMD8 CRC failure stage",
    "evidence": [
      "the exact frozen UF2 was launched through the normal PicoCalc uf2loader path; BOOTSEL was not required",
      "boot identity: app=next3-sd-cmd8-crc-b app_git=e78cabbe2041 bsp=0.9.0 bsp_git=5a27dc7a0085-dirty variant=pio-rgb565 build=2026-08-10T05:30:00Z clock=250000",
      "CMD0 arg=00000000 crc=0x95 r1=0x01; CMD8 arg=000001aa crc=0x85 r1=0x09 r7=ffffffff",
      "R1 0x09 contains only idle-state and COM_CRC_ERROR among the frozen reason bits; initialization reports cmd8_fail detail=9",
      "CMD55, ACMD41, CMD58, filesystem access, and key input are absent",
      "evidence/uf2loader-uart.log SHA-256 fe807c7c440f4ea8e73996d87381a6491b5279db59a244f02424260e6bdaa637 contains 46 identical complete EVIDENCE markers",
      "evidence/final.jpg SHA-256 ad7d4c28f7ca17d43420dd5d71eaaadbdf9e84b9fbc0b66884da3a08c788c13d; supplied original SHA-256 c2cba5aea22e09fe681d5725a944e38daf8f6c92583b1b1099ade31c902af2b2; decoded RGB SHA-256 639b9bf9d8d9ff1801ae557fb47c7ea5c9fe4e1d9814e23e445812be9c5033e5; repository copy has location metadata removed without changing decoded pixels",
      "the final photograph shows the expected white top strip and red center and bottom failure regions",
      "no unrelated exception, unsupported MMIO, identity mismatch, or incomplete capture is present"
    ]
  },
  "reason_match": {
    "status": "pending",
    "expected_reason": "SD SPI CMD8 CRC7 rejection with R1 COM_CRC_ERROR at the CMD8 initialization stage",
    "emulator_reason": null,
    "hardware_reason": "SD SPI CMD8 CRC7 rejection with R1 COM_CRC_ERROR at the CMD8 initialization stage"
  },
  "classification": "pending",
  "kpi_effect": {
    "negative_denominator_delta": 1,
    "correct_detection_delta": 0,
    "false_accept_delta": 0
  }
}
